{
  "schema_version": 1,
  "catalog_id": "zhulong-context-catalog",
  "catalog_version": "1.2.0",
  "authority": "recommended_context_only",
  "non_authority_statement": "This catalog recommends local reading context only. It does not grant read, execution, confirmation, promotion, or completion authority.",
  "modules": [
    {"id":"phase-intake-recon","path":"assets/references/audit-phase-intake-recon.md","title":"Intake and Recon phase protocol","phases":["intake","recon"],"selection_policy":"baseline","reason_code":"PHASE_INTAKE_RECON","authority":"recommended_context_only"},
    {"id":"phase-candidate-triage","path":"assets/references/audit-phase-candidate-triage.md","title":"Candidate and triage phase protocol","phases":["candidate_generation","triage"],"selection_policy":"baseline","reason_code":"PHASE_CANDIDATE_TRIAGE","authority":"recommended_context_only"},
    {"id":"phase-verification","path":"assets/references/audit-phase-verification.md","title":"Verification and severity phase protocol","phases":["verification","severity_escalation"],"selection_policy":"baseline","reason_code":"PHASE_VERIFICATION","authority":"recommended_context_only"},
    {"id":"phase-variant-discovery","path":"assets/references/audit-phase-variant-discovery.md","title":"Seeded variant discovery phase protocol","phases":["variant_discovery"],"selection_policy":"baseline","reason_code":"PHASE_VARIANT_DISCOVERY","authority":"recommended_context_only"},
    {"id":"phase-packaging-finalization","path":"assets/references/audit-phase-packaging-finalization.md","title":"Packaging and finalization phase protocol","phases":["packaging","finalization"],"selection_policy":"baseline","reason_code":"PHASE_PACKAGING_FINALIZATION","authority":"recommended_context_only"},
    {"id":"phase-recording","path":"assets/references/audit-phase-recording.md","title":"Opt-in recording phase protocol","phases":["recording"],"selection_policy":"baseline","reason_code":"PHASE_RECORDING","authority":"recommended_context_only"},
    {"id":"continuation-state","path":"assets/references/audit-continuation-state.md","title":"Continuation and state protocol","phases":["intake","recon","candidate_generation","triage","verification","severity_escalation","variant_discovery","packaging","finalization","recording"],"selection_policy":"baseline","reason_code":"CONTINUATION_STATE","authority":"recommended_context_only"},
    {"id":"repo-preparation","path":"assets/references/repo-preparation.md","title":"Repository preparation","phases":["intake","recon"],"selection_policy":"baseline","reason_code":"REPO_PREPARATION","authority":"recommended_context_only"},
    {"id":"path-discipline","path":"assets/references/path-discipline.md","title":"Path discipline","phases":["intake","recon","candidate_generation","verification","packaging","finalization"],"selection_policy":"baseline","reason_code":"PATH_DISCIPLINE","authority":"recommended_context_only"},
    {"id":"security-tooling","path":"assets/references/recommended-security-tooling.md","title":"Security tooling reference","phases":["recon","candidate_generation"],"selection_policy":"baseline","reason_code":"SECURITY_TOOLING","authority":"recommended_context_only"},
    {"id":"java-web","path":"assets/references/java-web-audit-playbook.md","title":"Java Web audit playbook","phases":["recon","candidate_generation","verification"],"selection_policy":"conditional","attack_surface_hints":["java-web"],"reason_code":"JAVA_WEB_PLAYBOOK","authority":"recommended_context_only"},
    {"id":"go-web","path":"assets/references/go-web-audit-playbook.md","title":"Go Web audit playbook","phases":["recon","candidate_generation","verification"],"selection_policy":"conditional","attack_surface_hints":["go-web"],"reason_code":"GO_WEB_PLAYBOOK","authority":"recommended_context_only"},
    {"id":"nodejs-web","path":"assets/references/nodejs-web-audit-playbook.md","title":"Node.js Web audit playbook","phases":["recon","candidate_generation","verification"],"selection_policy":"conditional","attack_surface_hints":["node-web"],"reason_code":"NODE_WEB_PLAYBOOK","authority":"recommended_context_only"},
    {"id":"nodejs-library","path":"assets/references/nodejs-library-audit-playbook.md","title":"Node.js library audit playbook","phases":["recon","candidate_generation","verification"],"selection_policy":"conditional","attack_surface_hints":["node-library"],"reason_code":"NODE_LIBRARY_PLAYBOOK","authority":"recommended_context_only"},
    {"id":"python-web","path":"assets/references/python-web-audit-playbook.md","title":"Python Web audit playbook","phases":["recon","candidate_generation","verification"],"selection_policy":"conditional","attack_surface_hints":["python-web"],"reason_code":"PYTHON_WEB_PLAYBOOK","authority":"recommended_context_only"},
    {"id":"python-library","path":"assets/references/python-library-audit-playbook.md","title":"Python library audit playbook","phases":["recon","candidate_generation","verification"],"selection_policy":"conditional","attack_surface_hints":["python-library"],"reason_code":"PYTHON_LIBRARY_PLAYBOOK","authority":"recommended_context_only"},
    {"id":"php-swoole","path":"assets/references/php-swoole-audit-playbook.md","title":"PHP Swoole audit playbook","phases":["recon","candidate_generation","verification"],"selection_policy":"conditional","attack_surface_hints":["php-swoole","php-web"],"reason_code":"PHP_SWOOLE_PLAYBOOK","authority":"recommended_context_only"},
    {"id":"ssrf-checklist","path":"assets/references/ssrf-checklist.md","title":"SSRF checklist","phases":["candidate_generation","verification"],"selection_policy":"conditional","attack_surface_hints":["ssrf-sinks"],"bug_classes":["ssrf"],"reason_code":"SSRF_CHECKLIST","authority":"recommended_context_only"},
    {"id":"path-traversal-checklist","path":"assets/references/path-traversal-checklist.md","title":"Path traversal checklist","phases":["candidate_generation","verification"],"selection_policy":"conditional","bug_classes":["path-traversal"],"reason_code":"PATH_TRAVERSAL_CHECKLIST","authority":"recommended_context_only"},
    {"id":"prototype-pollution-checklist","path":"assets/references/prototype-pollution-checklist.md","title":"Prototype pollution checklist","phases":["candidate_generation","verification"],"selection_policy":"conditional","bug_classes":["prototype-pollution"],"reason_code":"PROTOTYPE_POLLUTION_CHECKLIST","authority":"recommended_context_only"},
    {"id":"docker-resource-hygiene","path":"assets/references/docker-resource-hygiene.md","title":"Docker resource hygiene","phases":["verification","severity_escalation","variant_discovery","finalization"],"selection_policy":"baseline","reason_code":"DOCKER_HYGIENE","authority":"recommended_context_only"},
    {"id":"bundle-generation","path":"assets/references/bundle-generation-checklist.md","title":"Bundle generation checklist","phases":["packaging"],"selection_policy":"baseline","reason_code":"BUNDLE_GENERATION","authority":"recommended_context_only"},
    {"id":"bundle-rule-mapping","path":"assets/references/bundle-rule-mapping.md","title":"Bundle rule mapping","phases":["packaging"],"selection_policy":"baseline","reason_code":"BUNDLE_RULE_MAPPING","authority":"recommended_context_only"},
    {"id":"docx-format","path":"assets/references/confirmed-vuln-docx-format.md","title":"Confirmed vulnerability DOCX format","phases":["packaging"],"selection_policy":"baseline","reason_code":"DOCX_FORMAT","authority":"recommended_context_only"},
    {"id":"document-stability","path":"assets/references/document-output-stability.md","title":"Document output stability","phases":["packaging"],"selection_policy":"baseline","reason_code":"DOCUMENT_STABILITY","authority":"recommended_context_only"},
    {"id":"reviewer-readiness","path":"assets/references/reviewer-readiness-validator-gates.md","title":"Reviewer readiness gates","phases":["packaging","finalization"],"selection_policy":"baseline","reason_code":"REVIEWER_READINESS","authority":"recommended_context_only"}
  ]
}
